### ISSUE TITLE
Random ping loss in non-phy zynqmp implementation

### ISSUE THREAD

**Issue by vborchsh** [corundum/corundum#198]
Hello all,

I faced tricky issue. I use corundum with ZynqMP. As mentioned [here](https://github.com/corundum/corundum/issues/196) I've bring up the interface and see ping and iperf over 10G phy. My next step is non-phy implementation in FPGA logic. Right now I've been trying to run two interface inside FPGA, without physical layer, so its just two AXI streams of mqnic_axi core connected each other.

And I see weird things. For the instance, I run several ping packets from eth2 (10.0.0.20) to eth1 (10.0.0.10), which are separated to different namespaces (with the same names with script by Alex). And I control packets in the FPGA logic by ILA. And some of these pings are ok, but some are missing.

Here are two dumps for the same command `ip netns exec eth2 ping 10.0.0.10 -c 1`, with only one packet:

1. "good" ping
![image](https://github.com/user-attachments/assets/08ee1da0-7db7-4a21-9118-9400bf326baa)

2. "bad" ping, reply packet is missed (second window)
![image](https://github.com/user-attachments/assets/f78d6667-8eac-41cb-9310-e79f2921dbd2)

In "bad" case I see missing write transaction for the reply packet. And indeed, tcpdump shows the next things:

ping
```
ping 10.0.0.10 -c 1
PING 10.0.0.10 (10.0.0.10): 56 data bytes
--- 10.0.0.10 ping statistics ---
1 packets transmitted, 0 packets received, 100% packet loss
```

eth2:
```
# tcpdump -i eth2
07:30:44.608105 IP 10.0.0.20 > 10.0.0.10: ICMP echo request, id 546, seq 0, length 64
```

eth1:
```
# tcpdump -i eth1
07:30:44.608226 IP 10.0.0.20 > 10.0.0.10: ICMP echo request, id 546, seq 0, length 64                                                                                                
07:30:44.608286 IP 10.0.0.10 > 10.0.0.20: ICMP echo reply, id 546, seq 0, length 64 
```

In "good" case both interfaces show request and response correctly. I'll come back with more details and dumps if you'd like so.

What it could be?

[ilas.zip](https://github.com/user-attachments/files/16247967/ilas.zip)

upd.: bring more details

**Comment by vborchsh** [comment]
Let me try to make it a bit clearer by this picture:

![image](https://github.com/user-attachments/assets/d68feb11-e8d5-4914-9d1a-27fd4da7e47b)

Red box is missed in case of missing ping.

**Comment by alexforencich** [comment]
If you send more than 1 ping packet are you still seeing this issue?  I have had at least one report of the first packet getting "stuck" somewhere until another packet comes along, but haven't yet had a chance to dig in to it further.

**Comment by vborchsh** [comment]
> If you send more than 1 ping packet are you still seeing this issue?

Yes, I do. Example for 4 packets:

```
# ping 10.0.0.10 -c 4
PING 10.0.0.10 (10.0.0.10): 56 data bytes
64 bytes from 10.0.0.10: seq=2 ttl=64 time=0.247 ms

--- 10.0.0.10 ping statistics ---
4 packets transmitted, 1 packets received, 75% packet loss
round-trip min/avg/max = 0.247/0.247/0.247 ms
```

Plus, the issue is random: every time random number of packet loss..

**Comment by vborchsh** [comment]
One interesting thing. When I run ping on both interfaces simultaneously no losses presents. But when I stop one of them - it starts losing the packets.

Example:

eth1
```
# ping 10.0.0.20
PING 10.0.0.20 (10.0.0.20): 56 data bytes

64 bytes from 10.0.0.20: seq=0 ttl=64 time=0.734 ms
64 bytes from 10.0.0.20: seq=5 ttl=64 time=0.480 ms
64 bytes from 10.0.0.20: seq=6 ttl=64 time=0.448 ms
64 bytes from 10.0.0.20: seq=7 ttl=64 time=0.452 ms
64 bytes from 10.0.0.20: seq=8 ttl=64 time=0.440 ms
64 bytes from 10.0.0.20: seq=9 ttl=64 time=0.452 ms
64 bytes from 10.0.0.20: seq=10 ttl=64 time=0.453 ms 
64 bytes from 10.0.0.20: seq=11 ttl=64 time=0.267 ms
^C
--- 10.0.0.20 ping statistics --- 
12 packets transmitted, 8 packets received, 33% packet loss
round-trip min/avg/max = 0.267/0.465/0.734 ms
```

eth2
```
# ping 10.0.0.10
PING 10.0.0.10 (10.0.0.10): 56 data bytes
64 bytes from 10.0.0.10: seq=0 ttl=64 time=0.674 ms
64 bytes from 10.0.0.10: seq=1 ttl=64 time=0.495 ms
64 bytes from 10.0.0.10: seq=2 ttl=64 time=0.438 ms
64 bytes from 10.0.0.10: seq=3 ttl=64 time=0.486 ms
64 bytes from 10.0.0.10: seq=4 ttl=64 time=0.494 ms
64 bytes from 10.0.0.10: seq=5 ttl=64 time=0.491 ms
64 bytes from 10.0.0.10: seq=6 ttl=64 time=0.474 ms
^C
--- 10.0.0.10 ping statistics ---
7 packets transmitted, 7 packets received, 0% packet loss
round-trip min/avg/max = 0.438/0.507/0.674 ms
```

So, here I started eth1 to eth2 ping and you can see that first 4 packets are missed (seq 1..4, except zero). But then I started ping at the second interface eth2 to eth1. And here we go: ping in both directions works with no losses. Until I stop one of them.

**Comment by vborchsh** [comment]
A bit of debugging:


Good case:

AXI MM
```
rd 000006b5c3c40, 000000080654ba020000006200000000 00000000000000000000000000000000 00000000000000000000000000000000 00000000000000000000000000000000
rd 000080654ba02, <data packet, 6 words>
packet to the interface
wr 000006b5a9e20, 00000000000000000000006204f1000b 00000000000000000000000000000000
rd 000006b15cf10, 00000008073720000000100000000000
wr 000006b149e00, 000000000000000000000000000f0000 00000000000000000000000000000000
wr 0000807372000, <data packet, 6 words>
three more writes
```

Bad case:
```
rd 000006b294c40, 00000008002802020000006200000000 00000000000000000000000000000000 00000000000000000000000000000000 00000000000000000000000000000000
rd 0000800280202, <data packet, 6 words>
packet to the interface
wr 000006b27a620, 0000000000000000000000620531000b 00000000000000000000000000000000
! no read here
wr 000006b12a5a0, 000000000000000000000000000f0000 00000000000000000000000000000000
! no three writes here
```

In both cases transmitting (reading from DMA, first two transactions) works with no issues. During "bad" receiving I see missing AXI transactions. The most interesting one: missing reading with memory offset in CPU RAM for the packet.

As far as I understood, there is no DMA read transaction which provides memory offset for received packet, for some reasons.

**Comment by vborchsh** [comment]
As usual, it was my fault :) wrong connection of axi stream interfaces in the fpga
